{
  "$schema": "https://json-schema.org/draft/2020-12/schema",
  "$id": "https://atlas-richie.dev/contracts/sentinel/rule-load-observation/v1/schema.json",
  "title": "Atlas Richie Sentinel Rule Load Observation V1",
  "type": "object",
  "additionalProperties": false,
  "required": [
    "protocol_version",
    "observation_id",
    "process_epoch",
    "sequence",
    "binding_id",
    "profile_id",
    "event_kind",
    "active_snapshot",
    "attempt",
    "observed_at"
  ],
  "properties": {
    "protocol_version": { "const": "atlas-richie.sentinel.rule-load-observation/v1" },
    "observation_id": { "$ref": "#/$defs/uuidV4" },
    "process_epoch": { "$ref": "#/$defs/uuidV4" },
    "sequence": { "type": "integer", "minimum": 1, "maximum": 9007199254740991 },
    "binding_id": { "$ref": "#/$defs/identifier" },
    "profile_id": { "$ref": "#/$defs/identifier" },
    "event_kind": { "enum": ["snapshot_applied", "snapshot_failed", "heartbeat"] },
    "active_snapshot": { "anyOf": [{ "$ref": "#/$defs/snapshot" }, { "type": "null" }] },
    "attempt": { "anyOf": [{ "$ref": "#/$defs/attempt" }, { "type": "null" }] },
    "observed_at": { "type": "string", "pattern": "^\\d{4}-\\d{2}-\\d{2}T\\d{2}:\\d{2}:\\d{2}\\.\\d{3}Z$" }
  },
  "$defs": {
    "uuidV4": { "type": "string", "pattern": "^[0-9a-f]{8}-[0-9a-f]{4}-4[0-9a-f]{3}-[89ab][0-9a-f]{3}-[0-9a-f]{12}$" },
    "identifier": { "type": "string", "pattern": "^[A-Za-z0-9][A-Za-z0-9._:-]{0,199}$" },
    "digest": { "type": "string", "pattern": "^[0-9a-f]{64}$" },
    "sourceRevision": {
      "anyOf": [
        { "type": "null" },
        { "type": "string", "minLength": 1, "maxLength": 200, "pattern": "^[\\x20-\\x7E]+$" }
      ]
    },
    "member": {
      "type": "object",
      "additionalProperties": false,
      "required": ["rule_kind", "fingerprint_sha256"],
      "properties": {
        "rule_kind": { "enum": ["flow", "degrade", "param_flow", "system", "authority"] },
        "fingerprint_sha256": { "$ref": "#/$defs/digest" }
      }
    },
    "snapshot": {
      "type": "object",
      "additionalProperties": false,
      "required": ["source_revision", "source_bytes_sha256", "canonical_rules_sha256", "membership_complete", "members"],
      "properties": {
        "source_revision": { "$ref": "#/$defs/sourceRevision" },
        "source_bytes_sha256": { "anyOf": [{ "$ref": "#/$defs/digest" }, { "type": "null" }] },
        "canonical_rules_sha256": { "$ref": "#/$defs/digest" },
        "membership_complete": { "type": "boolean" },
        "members": { "type": "array", "maxItems": 8192, "items": { "$ref": "#/$defs/member" } }
      },
      "allOf": [
        {
          "if": { "properties": { "membership_complete": { "const": false } } },
          "then": { "properties": { "members": { "maxItems": 0 } } }
        }
      ]
    },
    "attempt": {
      "type": "object",
      "additionalProperties": false,
      "required": ["source_revision", "source_bytes_sha256", "canonical_rules_sha256", "failure_reason"],
      "properties": {
        "source_revision": { "$ref": "#/$defs/sourceRevision" },
        "source_bytes_sha256": { "anyOf": [{ "$ref": "#/$defs/digest" }, { "type": "null" }] },
        "canonical_rules_sha256": { "anyOf": [{ "$ref": "#/$defs/digest" }, { "type": "null" }] },
        "failure_reason": { "enum": ["source_unavailable", "decode_rejected", "profile_unsupported", "validation_rejected", "apply_failed"] }
      }
    }
  },
  "allOf": [
    {
      "if": { "properties": { "event_kind": { "const": "snapshot_applied" } } },
      "then": {
        "properties": { "active_snapshot": { "$ref": "#/$defs/snapshot" }, "attempt": { "type": "null" } }
      }
    },
    {
      "if": { "properties": { "event_kind": { "const": "snapshot_failed" } } },
      "then": { "properties": { "attempt": { "$ref": "#/$defs/attempt" } } }
    },
    {
      "if": { "properties": { "event_kind": { "const": "heartbeat" } } },
      "then": { "properties": { "attempt": { "type": "null" } } }
    }
  ]
}
