{"protocol_version":"atlas-richie.sentinel.rule-load-observation/v1","observation_id":"3d6f0a82-39e2-4e57-a81e-029808927952","process_epoch":"590e8a11-e2fb-4cf9-9f01-8230f249875a","sequence":3,"binding_id":"binding-1","profile_id":"sentinel-python-v1","event_kind":"heartbeat","active_snapshot":null,"attempt":null,"observed_at":"2026-10-16T02:30:47.123Z"}
