{"protocol_version":"atlas-richie.sentinel.rule-load-observation/v1","observation_id":"3d6f0a82-39e2-4e57-a81e-029808927952","process_epoch":"590e8a11-e2fb-4cf9-9f01-8230f249875a","sequence":1,"binding_id":"binding-1","profile_id":"sentinel-python-v1","event_kind":"snapshot_applied","active_snapshot":{"source_revision":"provider-revision-7","source_bytes_sha256":"0000000000000000000000000000000000000000000000000000000000000000","canonical_rules_sha256":"1111111111111111111111111111111111111111111111111111111111111111","membership_complete":true,"members":[{"rule_kind":"flow","fingerprint_sha256":"0000000000000000000000000000000000000000000000000000000000000000"},{"rule_kind":"flow","fingerprint_sha256":"1111111111111111111111111111111111111111111111111111111111111111"}]},"attempt":null,"observed_at":"2026-10-16T02:30:45.123Z"}
